{
  "schema_version": "axiom.compiler_scale_proof.v1",
  "contract": "self_hosting.compiler_scale_runtime_proof",
  "issue": 1427,
  "dependency_issues": [1425, 1426, 1434, 1436, 1437, 1438, 1439, 1440, 1476, 1477],
  "target_contract": {
    "package_roles": ["compiler.backend.contracts", "compiler.backend.native", "compiler.commands", "compiler.diagnostics", "compiler.evidence", "compiler.hir", "compiler.mir", "compiler.package_graph", "compiler.services.lsp", "compiler.stdlib", "compiler.syntax"],
    "command_surfaces": ["build", "check", "doc", "lsp", "run", "test"],
    "pipeline_stages": ["backend_planning", "command_dispatch", "diagnostics", "evidence_linking", "hir_typing", "mir_planning", "package_graph", "source_loading", "syntax_analysis"],
    "runtime_origins": ["argv", "cwd", "environment", "filesystem_source", "prior_command_artifact", "stdin"],
    "scale_floor": {
      "minimum_packages": 8,
      "minimum_source_files": 20,
      "minimum_axiom_lines": 2000,
      "minimum_functions": 80,
      "minimum_semantic_nodes": 1000,
      "minimum_dependency_edges": 12,
      "minimum_command_surfaces": 6,
      "minimum_runtime_inputs": 2,
      "fixture_only_shortcut_forbidden": true
    },
    "runtime_sensitivity": {
      "artifact_reuse": "same_artifact_digest",
      "input_pair": "two_post_build_source_trees",
      "output_relation": "distinct_semantic_outputs_for_distinct_inputs",
      "rebuilds_between_inputs": 0,
      "runtime_origin_required": true
    },
    "build_purity": {
      "forbidden_build_effects": ["clock", "crypto", "environment", "filesystem", "network", "process", "randomness", "runtime_authority"],
      "runtime_effect_boundary": "effects_execute_only_after_artifact_start",
      "execution_mode": "native_runtime",
      "lowering_mode": "runtime_lowered",
      "generated_host_source": "absent"
    },
    "associative_state": {
      "table_kinds": ["dependency_table", "symbol_table", "work_set"],
      "runtime_allocated": true,
      "fixed_literal_tables_allowed": false,
      "deterministic_iteration_required": true
    },
    "parity_policy": "current_compiler_or_versioned_semantic_contract",
    "evidence_graph_fields": ["artifact_digest", "backend_plan", "capability_evidence", "command_surface", "input_digest", "lowering_mode", "mir_digest", "output_digest", "package_id", "runtime_origin", "source_provenance", "target_support"],
    "diagnostics": ["backend.compiler_scale_runtime_lowering_required", "self_host.compiler_scale_dependencies_incomplete", "self_host.compiler_scale_fixture_only", "self_host.compiler_scale_proof_not_qualified", "self_host.compiler_scale_shortcut_detected"],
    "prohibited_fallbacks": ["build_time_effect_execution", "compiler_evaluator_runtime", "fixed_literal_associative_tables", "fixture_specific_output", "generated_host_source", "rebuild_between_inputs", "static_output_replay", "toolchain_process_in_workload_path"]
  },
  "current_floor": {
    "tier": "syntax_only",
    "status": "blocked",
    "implementation_owner": "legacy_bootstrap",
    "source_layout_contract_present": true,
    "diagnostics_spike_present": true,
    "direct_native_subset_present": true,
    "boundary_contracts_present": true,
    "command_contract_present": true,
    "compiler_scale_package_present": false,
    "scale_floor_met": false,
    "six_command_surfaces_proven": false,
    "runtime_source_ab_proven": false,
    "same_artifact_reuse_proven": false,
    "runtime_maps_sets_proven": false,
    "program_host_abi_proven": false,
    "build_effect_purity_proven": false,
    "executable_mir_runtime_proven": false,
    "lifecycle_ownership_proven": false,
    "generated_host_source_absent_proven": false,
    "parity_proven": false,
    "evidence_graph_proven": false,
    "all_supported_targets_proven": false,
    "all_boundary_gates_proven": false,
    "bootstrap_evidence": ["docs/axiom-compiler-source-layout.md", "docs/compiler-command-lsp-packages.md", "docs/compiler-diagnostics-syntax.md", "scripts/ci/run-self-hosting-spike-parity.sh", "stage1/compiler-contracts/snapshots/build.json", "stage1/compiler-contracts/snapshots/command-lsp.json", "stage1/selfhost/compiler-diagnostics-distance-spike/axiom.toml", "stage1/selfhost/compiler-diagnostics-spike/axiom.toml"],
    "target_gaps": ["all_boundary_gates", "all_supported_targets", "build_effect_purity", "compiler_scale_package", "evidence_graph", "executable_mir_runtime", "generated_host_source_absence", "lifecycle_ownership", "parity", "program_host_abi", "runtime_maps_sets", "runtime_source_ab", "same_artifact_reuse", "scale_floor", "six_command_surfaces"]
  },
  "qualification": {
    "fixture_scaffolding_only": true,
    "workload_dispatch_authorized": false,
    "dependencies_must_be_runtime_complete": true,
    "required_proofs": ["all_boundary_gates", "all_supported_targets", "build_effect_purity", "compiler_scale_package", "evidence_graph", "executable_mir_runtime", "generated_host_source_absence", "lifecycle_ownership", "parity_or_versioned_contract", "program_host_abi", "runtime_maps_sets", "runtime_source_ab", "same_artifact_reuse", "scale_floor", "six_command_surfaces"],
    "readiness_promotable": false,
    "review_policy": "independent_acceptance_review_required",
    "fail_closed_diagnostic": "self_host.compiler_scale_proof_not_qualified"
  },
  "fixtures": [
    {"id": "compiler-scale-proof-v1/all-boundary-gates", "category": "boundary", "status": "target_gap", "runtime_origin": false, "blocks_readiness": true, "scenario": "package diagnostics syntax HIR MIR command build purity lifecycle ownership and direct-native gates pass against the exact workload", "evidence": ["docs/production-language-readiness.json::compiler_scale_runtime_proof"]},
    {"id": "compiler-scale-proof-v1/artifact-reuse", "category": "runtime", "status": "target_gap", "runtime_origin": true, "blocks_readiness": true, "scenario": "one artifact digest processes both post-build source trees without rebuilding", "evidence": ["docs/compiler-scale-proof-v1.md::Build once and run many"]},
    {"id": "compiler-scale-proof-v1/bootstrap-boundary-contracts", "category": "boundary", "status": "bootstrap_pass", "runtime_origin": false, "blocks_readiness": false, "scenario": "the future compiler package roles and validation boundaries are published", "evidence": ["docs/axiom-compiler-source-layout.md::## Package Map"]},
    {"id": "compiler-scale-proof-v1/bootstrap-command-contract", "category": "command", "status": "bootstrap_pass", "runtime_origin": false, "blocks_readiness": false, "scenario": "command and LSP package APIs have a checked target-neutral boundary", "evidence": ["stage1/compiler-contracts/snapshots/command-lsp.json::compiler.commands"]},
    {"id": "compiler-scale-proof-v1/bootstrap-diagnostics-spike", "category": "package", "status": "bootstrap_pass", "runtime_origin": false, "blocks_readiness": false, "scenario": "small AxiOM diagnostics packages establish feasibility without satisfying the scale floor", "evidence": ["stage1/selfhost/compiler-diagnostics-distance-spike/axiom.toml", "stage1/selfhost/compiler-diagnostics-spike/axiom.toml"]},
    {"id": "compiler-scale-proof-v1/bootstrap-direct-native-subset", "category": "runtime", "status": "bootstrap_pass", "runtime_origin": false, "blocks_readiness": false, "scenario": "the supported direct-native subset emits no generated host source", "evidence": ["stage1/compiler-contracts/snapshots/build.json::\"generated_rust\": null"]},
    {"id": "compiler-scale-proof-v1/bootstrap-source-layout", "category": "package", "status": "bootstrap_pass", "runtime_origin": false, "blocks_readiness": false, "scenario": "the migration package map defines the target compiler architecture", "evidence": ["docs/axiom-compiler-source-layout.md::## Public Self-Hosted Compiler API"]},
    {"id": "compiler-scale-proof-v1/build-effect-purity", "category": "purity", "status": "target_gap", "runtime_origin": true, "blocks_readiness": true, "scenario": "building cannot execute runtime authority or freeze runtime values into output", "evidence": ["docs/production-language-roadmap.md::runtime authority must never"]},
    {"id": "compiler-scale-proof-v1/compiler-scale-package", "category": "package", "status": "target_gap", "runtime_origin": true, "blocks_readiness": true, "scenario": "a checked multi-package AxiOM compiler workload owns every required pipeline role", "evidence": ["docs/production-language-readiness.json::compiler_scale_runtime_proof"]},
    {"id": "compiler-scale-proof-v1/evidence-graph", "category": "evidence", "status": "target_gap", "runtime_origin": true, "blocks_readiness": true, "scenario": "one graph links source package MIR lowering capabilities outputs target and exact artifact", "evidence": ["docs/compiler-scale-proof-v1.md::Evidence graph"]},
    {"id": "compiler-scale-proof-v1/executable-mir", "category": "runtime", "status": "target_gap", "runtime_origin": true, "blocks_readiness": true, "scenario": "the workload executes through runtime-lowered MIR rather than compiler evaluation", "evidence": ["docs/production-language-readiness.json::executable_mir"]},
    {"id": "compiler-scale-proof-v1/generated-host-source-absence", "category": "purity", "status": "target_gap", "runtime_origin": false, "blocks_readiness": true, "scenario": "every compiler-scale build run and test report proves generated host source is absent", "evidence": ["docs/rust-exit-readiness.md::Generated-Rust removal"]},
    {"id": "compiler-scale-proof-v1/lifecycle-ownership", "category": "lifecycle", "status": "target_gap", "runtime_origin": true, "blocks_readiness": true, "scenario": "dynamic compiler values maps resources borrows and drops remain correct on all exits", "evidence": ["docs/production-language-readiness.json::runtime_lifecycle"]},